{
  "created_at": "2026-10-16T05:09:08.940424Z",
  "files": {
    "output_candidates": {
      "hash": "sha256:d92bf0644f386e83b860af461a8f2f07e64324f4e8dca4399d5a306a5ef0ef43",
      "path": "translation-data/retired/derivations/audit-sets-000j-complete-20261010/output-candidates.jsonl"
    },
    "output_units": {
      "hash": "sha256:27609f78ed40fb1eb582ec54886f0fa6ef54c0912d187dd660ca36c5c8aa6e43",
      "path": "translation-data/retired/derivations/audit-sets-000j-complete-20261010/output-units.jsonl"
    }
  },
  "origin_commit": "5b527d9cf753ba3f589d1cc7fe9d18be31ddfd81",
  "prior_derivation_id": "audit-sets-000j-complete-20261010",
  "record": {
    "hash": "sha256:45cdefe2e6c46426df08e76ef902cee225952bfab07d1f0f3a3274c5fe2e5053",
    "path": "translation-data/derivations/audit-sets-000j-complete-20261010.json"
  },
  "schema_version": 1,
  "source_commit": "a04446e57ec1fbc252a871afcec7752fb2807b14",
  "successor_derivation_id": "audit-bulk-extra-sets-000j-20261016"
}
