{
  "created_at": "2026-10-16T05:09:08.940424Z",
  "files": {
    "output_candidates": {
      "hash": "sha256:63adba29fb3a99f349f4f88e1b3501a152835a59d5d5fdb6e83092792dcf98cf",
      "path": "translation-data/retired/derivations/audit-categories-02c3-complete-20261009/output-candidates.jsonl"
    },
    "output_units": {
      "hash": "sha256:03c78964d31dbdde377485284907f3e823b77b1c06001a250d90324b71412dba",
      "path": "translation-data/retired/derivations/audit-categories-02c3-complete-20261009/output-units.jsonl"
    }
  },
  "origin_commit": "5b527d9cf753ba3f589d1cc7fe9d18be31ddfd81",
  "prior_derivation_id": "audit-categories-02c3-complete-20261009",
  "record": {
    "hash": "sha256:75d30dd71e828dd76b4352cfe45407ad7f96bb5702d0f955f8b5e56d77c07746",
    "path": "translation-data/derivations/audit-categories-02c3-complete-20261009.json"
  },
  "schema_version": 1,
  "source_commit": "a04446e57ec1fbc252a871afcec7752fb2807b14",
  "successor_derivation_id": "audit-bulk-extra-categories-02c3-20261016"
}
