{
  "created_at": "2026-10-16T05:09:08.940424Z",
  "files": {
    "output_candidates": {
      "hash": "sha256:7f4c64c302f3532e934c362c2d65d35cef305ba27d5a8585ba0e37c4e5e60b37",
      "path": "translation-data/retired/derivations/audit-categories-001o-yoneda-complete-20261012/output-candidates.jsonl"
    },
    "output_units": {
      "hash": "sha256:e34dbbe803ea4e84a5b55a310224d5337bb7ed9edd8d292d46def989c51aaa9b",
      "path": "translation-data/retired/derivations/audit-categories-001o-yoneda-complete-20261012/output-units.jsonl"
    }
  },
  "origin_commit": "5b527d9cf753ba3f589d1cc7fe9d18be31ddfd81",
  "prior_derivation_id": "audit-categories-001o-yoneda-complete-20261012",
  "record": {
    "hash": "sha256:2fbf1d7569047ec16ccde13024acd1914caf69f01ad9eaf64c84daff0b7383c9",
    "path": "translation-data/derivations/audit-categories-001o-yoneda-complete-20261012.json"
  },
  "schema_version": 1,
  "source_commit": "a04446e57ec1fbc252a871afcec7752fb2807b14",
  "successor_derivation_id": "audit-bulk-extra-categories-001o-20261016"
}
