{
  "created_at": "2026-10-16T05:09:08.940424Z",
  "files": {
    "output_candidates": {
      "hash": "sha256:fef457526d819f87d7ba0dca5ec0c0040b1dbb3d85f1b3077ba393e744b198ad",
      "path": "translation-data/retired/derivations/audit-sets-000r-complete-20261009/output-candidates.jsonl"
    },
    "output_units": {
      "hash": "sha256:e7b96966617890e40b38ea0c4b65df7bc785ce387d3f3ee310062b472c8d894b",
      "path": "translation-data/retired/derivations/audit-sets-000r-complete-20261009/output-units.jsonl"
    }
  },
  "origin_commit": "5b527d9cf753ba3f589d1cc7fe9d18be31ddfd81",
  "prior_derivation_id": "audit-sets-000r-complete-20261009",
  "record": {
    "hash": "sha256:760bcf32ba81ea9f1c2242262958e282a2d816a10f76683ed096d072fd1b55ac",
    "path": "translation-data/derivations/audit-sets-000r-complete-20261009.json"
  },
  "schema_version": 1,
  "source_commit": "a04446e57ec1fbc252a871afcec7752fb2807b14",
  "successor_derivation_id": "audit-bulk-extra-sets-000r-20261016"
}
