{
  "created_at": "2026-10-16T05:09:08.940424Z",
  "files": {
    "output_candidates": {
      "hash": "sha256:e4555572dd553c5f2617786f6c0df47a996e5ff6810f02094a10cda9cfb8e660",
      "path": "translation-data/retired/derivations/audit-categories-05sg-complete-20261009/output-candidates.jsonl"
    },
    "output_units": {
      "hash": "sha256:e8f2cab63ec1b38e22123ea2b0fb32fbc740dd20cd7b006e43a6d5f7a8d3bea5",
      "path": "translation-data/retired/derivations/audit-categories-05sg-complete-20261009/output-units.jsonl"
    }
  },
  "origin_commit": "5b527d9cf753ba3f589d1cc7fe9d18be31ddfd81",
  "prior_derivation_id": "audit-categories-05sg-complete-20261009",
  "record": {
    "hash": "sha256:bb37fb4f30b780d9dd77c4deb03290a4c9a07ac79232df37a565eda9f56020aa",
    "path": "translation-data/derivations/audit-categories-05sg-complete-20261009.json"
  },
  "schema_version": 1,
  "source_commit": "a04446e57ec1fbc252a871afcec7752fb2807b14",
  "successor_derivation_id": "audit-bulk-extra-categories-05sg-20261016"
}
