{
  "created_at": "2026-10-16T05:09:08.940424Z",
  "files": {
    "output_candidates": {
      "hash": "sha256:6bf4a7003b5e497ba01d258091e8403526169043af2ce1008e11631277a1d893",
      "path": "translation-data/retired/derivations/audit-categories-002e-limits-complete-20261011/output-candidates.jsonl"
    },
    "output_units": {
      "hash": "sha256:5e40f871ca731093e18843591fb77a2cc904bb257244feab4aad3a01473ecd5b",
      "path": "translation-data/retired/derivations/audit-categories-002e-limits-complete-20261011/output-units.jsonl"
    }
  },
  "origin_commit": "5b527d9cf753ba3f589d1cc7fe9d18be31ddfd81",
  "prior_derivation_id": "audit-categories-002e-limits-complete-20261011",
  "record": {
    "hash": "sha256:069ec876a8533ce4c252affa834e4b15165ffa3b7944c78a40115fd13a9a8e1e",
    "path": "translation-data/derivations/audit-categories-002e-limits-complete-20261011.json"
  },
  "schema_version": 1,
  "source_commit": "a04446e57ec1fbc252a871afcec7752fb2807b14",
  "successor_derivation_id": "audit-bulk-extra-categories-002e-20261016"
}
