{
  "created_at": "2026-10-16T05:09:08.940424Z",
  "files": {
    "output_candidates": {
      "hash": "sha256:27c04dcab08d81aad6b021354ec78633b599ad5f1f399588e7d6ab1456187a34",
      "path": "translation-data/retired/derivations/audit-categories-001g-functors-complete-20261014/output-candidates.jsonl"
    },
    "output_units": {
      "hash": "sha256:a0118c49aabfa195a59787f4b33e24e01cfd9e70a896595f1dd54139733a232a",
      "path": "translation-data/retired/derivations/audit-categories-001g-functors-complete-20261014/output-units.jsonl"
    }
  },
  "origin_commit": "5b527d9cf753ba3f589d1cc7fe9d18be31ddfd81",
  "prior_derivation_id": "audit-categories-001g-functors-complete-20261014",
  "record": {
    "hash": "sha256:f1dc64f7a850ffaa6249fdf7850af93acf30552fd55f3fd75c0ef851e2096fea",
    "path": "translation-data/derivations/audit-categories-001g-functors-complete-20261014.json"
  },
  "schema_version": 1,
  "source_commit": "a04446e57ec1fbc252a871afcec7752fb2807b14",
  "successor_derivation_id": "audit-bulk-extra-categories-001g-20261016"
}
