{
  "created_at": "2026-10-16T05:09:08.940424Z",
  "files": {
    "output_candidates": {
      "hash": "sha256:a71360d2f3ba3e4061c4d852340690aa44b707c4c40c24cfec4bd8b65c69c3c7",
      "path": "translation-data/retired/derivations/audit-categories-04ay-20261006/output-candidates.jsonl"
    },
    "output_units": {
      "hash": "sha256:2be6f956b3faee965f708b5840441861b5a645ac65b4db09bebef3aa4bfb6414",
      "path": "translation-data/retired/derivations/audit-categories-04ay-20261006/output-units.jsonl"
    }
  },
  "origin_commit": "5b527d9cf753ba3f589d1cc7fe9d18be31ddfd81",
  "prior_derivation_id": "audit-categories-04ay-20261006",
  "record": {
    "hash": "sha256:fe768a42ba8abc1413470a9860ca4042021151fa5270454d18f96485b3dd2cb0",
    "path": "translation-data/derivations/audit-categories-04ay-20261006.json"
  },
  "schema_version": 1,
  "source_commit": "a04446e57ec1fbc252a871afcec7752fb2807b14",
  "successor_derivation_id": "audit-bulk-categories-04ay-20261015"
}
