{
  "created_at": "2026-10-16T05:09:08.940424Z",
  "files": {
    "output_candidates": {
      "hash": "sha256:5fa95d398ca6ad3c53bbe889b3af12ca318092c822789473af9b4254a6d4510d",
      "path": "translation-data/retired/derivations/audit-categories-0032-complete-20261009/output-candidates.jsonl"
    },
    "output_units": {
      "hash": "sha256:0b11b81b1534d27083df258dbb8481957ff92f21911a64b0c5f9ec434e992d7d",
      "path": "translation-data/retired/derivations/audit-categories-0032-complete-20261009/output-units.jsonl"
    }
  },
  "origin_commit": "5b527d9cf753ba3f589d1cc7fe9d18be31ddfd81",
  "prior_derivation_id": "audit-categories-0032-complete-20261009",
  "record": {
    "hash": "sha256:56f94dbf54d564ccf1ca150603800bb19ed15d2583886b4dc3a1e8abfc9b1772",
    "path": "translation-data/derivations/audit-categories-0032-complete-20261009.json"
  },
  "schema_version": 1,
  "source_commit": "a04446e57ec1fbc252a871afcec7752fb2807b14",
  "successor_derivation_id": "audit-bulk-extra-categories-0032-20261016"
}
